{
  "schema_version": 2,
  "commit_id": "CM-018fa2b3-12cd-7abc-8abc-0123456789ab",
  "capture_id": "CP-018fa2b3-12cd-7abc-8abc-0123456789ab",
  "object_id": "obj-sha256-5d000b44db178b31c4aca20a5ef5741adb7e14b8297a2139e83f4119c783dd5f",
  "observation_id": "OV-018fa2b3-12cd-7abc-8abc-0123456789ab",
  "acquisition_id": "AQ-018fa2b3-12cd-7abc-8abc-0123456789ab",
  "custody_event_id": "CU-018fa2b3-12cd-7abc-8abc-0123456789ab",
  "published_at": "2026-10-09T20:43:00+09:00",
  "writer_device_id": "DEV-SAMPLE",
  "writer_epoch": 1,
  "object_verified_sha256": "5d000b44db178b31c4aca20a5ef5741adb7e14b8297a2139e83f4119c783dd5f",
  "status": "COMMITTED"
}
